{
  "type": "rotation",
  "old_did": "did:agent:85HjrARQcZynJQj1NooqjspvDvuAVpPYhqq4kNtMB2TG",
  "new_did": "did:agent:4J3R6mNJLGfS7Dvexc8m1CPw6z5bkzJUsJprJg9kU2Pq",
  "ts": 1787499320,
  "signature": "b1b8e5256ec8aceec942f189b096dd7fb29bdbdb7fb3c8b81efc8aa386f373fb4b849c04f95145b3786a3ede6b1a946dfed3a83a6fe70052da036ff522629b03"
}